timestamp,stage,purpose,tool_or_model,units,cost_usd,notes
2026-04-29T09:00:00+03:00,planning,Implementation planning and execution sequencing,Codex local authoring,1 session,0.00,"Created implementation plan and progress tracker"
2026-04-29T09:20:00+03:00,methodology,Methodology and audit grounding,Codex local authoring,1 session,0.00,"Updated methodology and audit memo using Week 10 artifacts"
2026-04-29T09:40:00+03:00,schema,Compact benchmark schema design,Codex local authoring,1 session,0.00,"Refined schema and aligned evaluator expectations"
2026-04-29T10:00:00+03:00,evaluation,Evaluator migration and validation,Python local runtime,3 task validations,0.00,"Validated scoring_evaluator.py against compact-schema starter tasks"
2026-04-29T10:20:00+03:00,dataset_trace,Trace-derived conversion,Python local runtime,60 tasks,0.00,"Converted 60 Week 10 workflow outputs into compact JSONL tasks"
2026-04-29T10:35:00+03:00,dataset_trace,Trace heuristic refinement,Python local runtime,60 tasks,0.00,"Adjusted observed and expected action mapping to reduce abstain skew"
2026-04-29T10:50:00+03:00,dataset_split,Family-based split assignment,Python local runtime,60 tasks,0.00,"Assigned contamination-aware trace splits at family level"
2026-04-29T11:10:00+03:00,dataset_programmatic,Programmatic dataset generation,Python local runtime,60 tasks,0.00,"Generated balanced programmatic pool with send/exploratory_send/abstain/review coverage"
2026-04-29T11:25:00+03:00,documentation,Datasheet and methodology alignment,Codex local authoring,1 session,0.00,"Updated datasheet with current build status, split strategy, contamination protocol, and cost tracking"
